{
  "vertical": "energy",
  "summary": "stanovanje v Ljubljani, ne ve svoje letne porabe kwh, zeli cim nizjo ceno brez menjave storitve",
  "dontNeed": [
    "fiksni tarifni pribitek, ce ga ne rabi"
  ],
  "signals": {
    "annualKwh": null,
    "meterType": null,
    "hasGas": false,
    "annualGasKwh": null,
    "dayNightSplit": null,
    "priceCertaintyPref": null,
    "contractLockTolerance": null,
    "eInvoiceOk": null
  }
}
