{
  "vertical": "telco",
  "summary": "dvoclansko gospodinjstvo, gleda serije prek streaminga, sporta ne gleda, mobilno rabi zmerno",
  "dontNeed": [
    "Arena Sport Premium (sporta ne gleda)",
    "500 GB mobilnih podatkov (porabi okoli 15 GB)"
  ],
  "signals": {
    "dataNeedGB": "15",
    "watchesSport": false,
    "paidTvPacksUsed": [],
    "wantsFixedBroadband": true,
    "openToSwitchOperator": true,
    "travelsOutsideEU": false,
    "budgetPriority": true
  }
}
